{
  "dmgAssetName" : "REPLACE_WITH_DMG_ASSET_NAME",
  "dmgSHA256" : "REPLACE_WITH_64_LOWERCASE_HEX_CHARACTERS",
  "records" : [
    {
      "aboutReleaseIdentityVerified" : false,
      "applicationCopiedToApplications" : false,
      "applicationReplacementSucceeded" : false,
      "architecture" : "arm64",
      "browserDownloadQuarantineObserved" : false,
      "checksumVerified" : false,
      "dmgEjected" : false,
      "dmgMountedReadOnly" : false,
      "downloadedFromGitHubRelease" : false,
      "gatekeeperLaunchSucceeded" : false,
      "interfaceLanguageSwitchPersisted" : false,
      "machineDidNotBuildRelease" : false,
      "macOSBuild" : "REPLACE_WITH_BUILD",
      "macOSVersion" : "REPLACE_WITH_VERSION",
      "menuBarItemVisible" : false,
      "supportInformationContentFree" : false,
      "syntheticCodexDeepLinkSucceeded" : false,
      "testedAt" : "REPLACE_WITH_UTC_TIMESTAMP",
      "uninstallSucceeded" : false,
      "wingmanCLIUnavailableFallbackVerified" : false,
      "wingmanConsentPreviewVerified" : false,
      "wingmanRemoteReviewSucceeded" : false
    },
    {
      "aboutReleaseIdentityVerified" : false,
      "applicationCopiedToApplications" : false,
      "applicationReplacementSucceeded" : false,
      "architecture" : "x86_64",
      "browserDownloadQuarantineObserved" : false,
      "checksumVerified" : false,
      "dmgEjected" : false,
      "dmgMountedReadOnly" : false,
      "downloadedFromGitHubRelease" : false,
      "gatekeeperLaunchSucceeded" : false,
      "interfaceLanguageSwitchPersisted" : false,
      "machineDidNotBuildRelease" : false,
      "macOSBuild" : "REPLACE_WITH_BUILD",
      "macOSVersion" : "REPLACE_WITH_VERSION",
      "menuBarItemVisible" : false,
      "supportInformationContentFree" : false,
      "syntheticCodexDeepLinkSucceeded" : false,
      "testedAt" : "REPLACE_WITH_UTC_TIMESTAMP",
      "uninstallSucceeded" : false,
      "wingmanCLIUnavailableFallbackVerified" : false,
      "wingmanConsentPreviewVerified" : false,
      "wingmanRemoteReviewSucceeded" : false
    }
  ],
  "releaseCreatedAt" : "REPLACE_WITH_GITHUB_DRAFT_CREATED_AT",
  "releaseID" : 0,
  "releaseTag" : "REPLACE_WITH_RELEASE_TAG",
  "repository" : "mehmetsolakedu/activity-radar",
  "schemaVersion" : 1
}
